{
  "schema": "atlas.work/v1",
  "id": "W-02",
  "parent_id": null,
  "title": "Implement the limit change",
  "objective": "Preserve the contract while changing one constant",
  "outcome": "Source changes and tests ready for integration",
  "criteria": [
    {
      "id": "C-02",
      "text": "Tests confirm the new limit",
      "required_scope": "TEST",
      "artifact_ids": [
        "A-SOURCE"
      ]
    }
  ],
  "state": "DOING",
  "writer": "worker-demo",
  "write_scope": [
    "src/batch.py"
  ],
  "assigned_to": "worker-demo",
  "depends_on": [
    "W-01"
  ],
  "artifacts": [
    {
      "id": "A-SOURCE",
      "path": "src/batch.py",
      "sha256": "e1eb1c798d3a858909ccf30823aaad5829db6857aae2e8da6859b8663df35e18",
      "bytes": 33,
      "role": "output",
      "entity_ids": [
        "MOD-BATCH"
      ]
    }
  ],
  "evidence": [
    {
      "id": "E-ACTIVE",
      "check_id": "work.activity",
      "scope": "ACTIVITY",
      "subjects": [],
      "environment": "synthetic-example",
      "actor": "worker-demo",
      "at": "2026-10-17T03:00:00Z",
      "receipt": {
        "path": "receipts/activity.json",
        "sha256": "1d535ed6ce942df1797e69b97f587b49c048fb7d2cca987e6d82b2acda81ceec",
        "bytes": 208
      },
      "result": "PASS",
      "work_id": "W-02",
      "valid_until": "2026-10-17T03:10:00Z"
    }
  ],
  "acceptance": [],
  "activity": {
    "actor": "worker-demo",
    "observed_at": "2026-10-17T03:00:00Z",
    "valid_until": "2026-10-17T03:10:00Z",
    "evidence_id": "E-ACTIVE"
  },
  "blocker": null,
  "result": null,
  "remaining": "Change the limit and run the targeted test",
  "next_action": {
    "actor": "worker-demo",
    "action": "Complete the source change and targeted test; attach the receipt"
  },
  "events": [
    {
      "id": "EV-03",
      "at": "2026-10-17T03:00:00Z",
      "actor": "worker-demo",
      "kind": "STARTED",
      "summary": "Scoped source work started",
      "evidence_ids": [
        "E-ACTIVE"
      ]
    }
  ]
}
